id	wikidata_id	entity_types	source	targets	source_locale	target_locale
Q2712995_0	Q2712995	['Artwork']	Can you provide a brief summary of the storyline in Time to Live and Time to Die?	[{'translation': 'Können Sie eine kurze Zusammenfassung der Handlung in Zeit zu leben und Zeit zu sterben zur Verfügung stellen?', 'mention': 'Zeit zu leben und Zeit zu sterben'}]	en	de
Q2712995_1	Q2712995	['Artwork']	Who is the author of the novel Time to Live and Time to Die?	[{'translation': 'Wer ist der Autor des Romans Zeit zu leben und Zeit zu sterben?', 'mention': 'Zeit zu leben und Zeit zu sterben?'}]	en	de
Q2712995_2	Q2712995	['Artwork']	How would you describe the genre of Time to Live and Time to Die?	[{'translation': 'Wie würden Sie das Genre Zeit zu leben und Zeit zu sterben beschreiben?', 'mention': 'Zeit zu leben und Zeit zu sterben'}, {'translation': 'Wie würden Sie das Genre von Zeit zu leben und Zeit zu sterben beschreiben?', 'mention': 'Zeit zu leben und Zeit zu sterben'}]	en	de
Q2715152_0	Q2715152	['Artwork']	Describe The Parnassus in one word.	[{'translation': 'Beschreiben Sie Stanza della Segnatura im Vatikan für Papst Julius II., Wandfresko, Szene: Der Parnaß in einem Wort.', 'mention': 'Stanza della Segnatura im Vatikan für Papst Julius II., Wandfresko, Szene: Der Parnaß'}]	en	de
Q2715152_1	Q2715152	['Artwork']	Who created The Parnassus?	[{'translation': 'Wer hat Stanza della Segnatura im Vatikan für Papst Julius II., Wandfresko, Szene: Der Parnaß geschaffen?', 'mention': 'Stanza della Segnatura im Vatikan für Papst Julius II., Wandfresko, Szene: Der Parnaß'}]	en	de
Q2715152_2	Q2715152	['Artwork']	In what form is The Parnassus artwork?	[{'translation': 'In welcher Form ist das Stanza della Segnatura im Vatikan für Papst Julius II., Wandfresko, Szene: Der Parnaß Artwork?', 'mention': 'Stanza della Segnatura im Vatikan für Papst Julius II., Wandfresko, Szene: Der Parnaß'}, {'translation': 'In welcher Form ist Stanza della Segnatura im Vatikan für Papst Julius II., Wandfresko, Szene: Der Parnaß Artwork?', 'mention': 'Stanza della Segnatura im Vatikan für Papst Julius II., Wandfresko, Szene: Der Parnaß'}]	en	de
Q2719978_0	Q2719978	['Movie']	What is the plot of the movie Pennies from Heaven?	[{'translation': 'Was ist die Handlung des Films Tanz in den Wolken?', 'mention': 'Tanz in den Wolken'}]	en	de
Q2719978_1	Q2719978	['Movie']	What genre does the movie Pennies from Heaven belong to?	[{'translation': 'Zu welchem Genre gehört der Film Tanz in den Wolken?', 'mention': 'Tanz in den Wolken'}]	en	de
Q2719978_2	Q2719978	['Movie']	In which year was Pennies from Heaven released?	[{'translation': 'In welchem Jahr wurde Tanz in den Wolken veröffentlicht?', 'mention': 'Tanz in den Wolken'}]	en	de
Q272781_0	Q272781	['Place of worship']	What is the historical significance of the Jerónimos Monastery?	[{'translation': 'Was ist die historische Bedeutung des Mosteiro dos Jerónimos?', 'mention': 'Mosteiro dos Jerónimos'}]	en	de
Q272781_1	Q272781	['Place of worship']	What type of building is the Jerónimos Monastery?	[{'translation': 'Welche Art von Gebäude ist das Mosteiro dos Jerónimos?', 'mention': 'Mosteiro dos Jerónimos'}]	en	de
Q272781_2	Q272781	['Place of worship']	Where is the Jerónimos Monastery situated within the Lisbon District?	[{'translation': 'Wo befindet sich das Mosteiro dos Jerónimos im Stadtteil Lissabon?', 'mention': 'Mosteiro dos Jerónimos'}]	en	de
Q2739228_0	Q2739228	['Person', 'Fictional entity']	In what year was Snow White and the Seven Dwarfs released?	[{'translation': 'In welchem \u200b\u200bJahr wurde Schneewittchen und die sieben Zwerge veröffentlicht?', 'mention': 'Schneewittchen'}, {'translation': 'In welchem Jahr wurde Schneewittchen und die sieben Zwerge veröffentlicht?', 'mention': 'Schneewittchen'}]	en	de
Q2739228_1	Q2739228	['Person', 'Fictional entity']	What is the name of the famous Disney film that features Snow White?	[{'translation': 'Wie heißt der berühmte Disney-Film mit Schneewittchen?', 'mention': 'Schneewittchen'}]	en	de
Q2739228_2	Q2739228	['Person', 'Fictional entity']	How many dwarfs are there in the story of Snow White?	[{'translation': 'Wie viele Zwerge gibt es in der Geschichte von Schneewittchen?', 'mention': 'Schneewittchen'}]	en	de
Q276569_0	Q276569	['Place of worship']	How large is the Quba Mosque?	[{'translation': 'Wie groß ist die Moschee von Qubāʾ?', 'mention': 'Moschee von Qubāʾ'}]	en	de
Q276569_1	Q276569	['Place of worship']	What is the significance of the Quba Mosque?	[{'translation': 'Was ist die Bedeutung der Moschee von Qubāʾ?', 'mention': 'Moschee von Qubāʾ'}, {'translation': 'Was ist die Bedeutsamkeit der Moschee von Qubāʾ?', 'mention': 'Moschee von Qubāʾ'}]	en	de
Q276569_2	Q276569	['Place of worship']	When was the Quba Mosque built?	[{'translation': 'Wann wurde die Moschee von Qubāʾ gebaut?', 'mention': 'Moschee von Qubāʾ'}, {'translation': 'Wann wurde die Moschee von Qubāʾ erbaut?', 'mention': 'Moschee von Qubāʾ'}]	en	de
Q2820278_0	Q2820278	['Place of worship']	Can you tell me more about the abbey in Ardèche, France called Our Lady of the Snows?	[{'translation': 'Können Sie mir mehr über die Abtei in der Ardèche, Frankreich, namens Trappistenabtei Notre-Dame-des-Neiges erzählen?', 'mention': 'Trappistenabtei Notre-Dame-des-Neiges'}, {'translation': 'Können Sie mir mehr über die Trappistenabtei Notre-Dame-des-Neiges in Ardèche, Frankreich, erzählen?', 'mention': 'Trappistenabtei Notre-Dame-des-Neiges'}]	en	de
Q2820278_1	Q2820278	['Place of worship']	What is the significance of Our Lady of the Snows?	[{'translation': 'Was ist die Bedeutung von Trappistenabtei Notre-Dame-des-Neiges?', 'mention': 'Trappistenabtei Notre-Dame-des-Neiges'}, {'translation': 'Was ist die Bedeutung von der Trappistenabtei Notre-Dame-des-Neiges?', 'mention': 'Trappistenabtei Notre-Dame-des-Neiges'}, {'translation': 'Welche Bedeutung hat die Trappistenabtei Notre-Dame-des-Neiges?', 'mention': 'Trappistenabtei Notre-Dame-des-Neiges'}]	en	de
Q2820278_2	Q2820278	['Place of worship']	Is Our Lady of the Snows a place of worship?	[{'translation': 'Ist Trappistenabtei Notre-Dame-des-Neiges ein Ort der Anbetung?', 'mention': 'Trappistenabtei Notre-Dame-des-Neiges'}, {'translation': 'Ist die Trappistenabtei Notre-Dame-des-Neiges ein Ort der Anbetung?', 'mention': 'Trappistenabtei Notre-Dame-des-Neiges'}]	en	de
Q2820602_0	Q2820602	['Place of worship']	How old is Mont Sainte-Odile Abbey?	[{'translation': 'Wie alt ist das Kloster Hohenburg?', 'mention': 'Kloster Hohenburg'}, {'translation': 'Wie alt ist die Abtei Mont Sainte-Odile?', 'mention': 'Abtei Mont Sainte-Odile'}, {'translation': 'Wie alt ist Kloster Hohenburg?', 'mention': 'Kloster Hohenburg'}]	en	de
Q2820602_1	Q2820602	['Place of worship']	What type of place is Mont Sainte-Odile Abbey?	[{'translation': 'Welche Art von Ort ist das Kloster Hohenburg?', 'mention': 'Kloster Hohenburg'}, {'translation': 'Was für ein Ort ist die Abtei Mont Sainte-Odile?', 'mention': 'Abtei Mont Sainte-Odile'}, {'translation': 'Welche Art von Ort ist Kloster Hohenburg?', 'mention': 'Kloster Hohenburg'}, {'translation': 'welche Art von Ort ist die Abtei Mont Sainte-Odile?', 'mention': 'Abtei Mont Sainte-Odile'}]	en	de
Q2820602_2	Q2820602	['Place of worship']	What is the significance of Mont Sainte-Odile Abbey?	[{'translation': 'Was ist die Bedeutung von Kloster Hohenburg?', 'mention': 'Kloster Hohenburg'}, {'translation': 'Welche Bedeutung hat die Abtei Mont Sainte-Odile?', 'mention': 'Abtei Mont Sainte-Odile'}]	en	de
Q2918397_0	Q2918397	['Movie']	Which famous characters appear in The Bugs Bunny/Road Runner Movie?	[{'translation': 'Welche berühmten Charaktere erscheinen in Bugs Bunnys wilde, verwegene Jagd?', 'mention': 'Bugs Bunnys wilde, verwegene Jagd'}, {'translation': 'Welche berühmten Charaktere erscheinen in Bugs Bunnys wilde verwegene Jagd?', 'mention': 'Bugs Bunnys wilde verwegene Jagd'}]	en	de
Q2918397_1	Q2918397	['Movie']	When was The Bugs Bunny/Road Runner Movie released?	[{'translation': 'Wann wurde Bugs Bunnys wilde, verwegene Jagd veröffentlicht?', 'mention': 'Bugs Bunnys wilde, verwegene Jagd'}, {'translation': 'Wann wurde Bugs Bunnys wilde verwegene Jagd veröffentlicht?', 'mention': 'Bugs Bunnys wilde verwegene Jagd'}]	en	de
Q2918397_2	Q2918397	['Movie']	What type of film is The Bugs Bunny/Road Runner Movie?	[{'translation': 'Welche Art von Film ist Bugs Bunnys wilde, verwegene Jagd?', 'mention': 'Bugs Bunnys wilde, verwegene Jagd'}, {'translation': 'Welche Art von Film ist Bugs Bunnys wilde verwegene Jagd?', 'mention': 'Bugs Bunnys wilde verwegene Jagd'}]	en	de
Q303756_0	Q303756	['Landmark']	Can you provide a brief description of the Saint Sophia Cathedral in Novgorod?	[{'translation': 'Können Sie eine kurze Beschreibung der Sophienkathedrale in Nowgorod geben?', 'mention': 'Sophienkathedrale'}]	en	de
Q303756_1	Q303756	['Landmark']	Where is Saint Sophia Cathedral located in Novgorod?	[{'translation': 'Wo befindet sich die Sophienkathedrale in Nowgorod?', 'mention': 'Sophienkathedrale'}]	en	de
Q303756_2	Q303756	['Landmark']	What type of landmark is Saint Sophia Cathedral in Novgorod?	[{'translation': 'Welche Art von Wahrzeichen ist die Sophienkathedrale in Nowgorod?', 'mention': 'Sophienkathedrale'}, {'translation': 'Was für ein Wahrzeichen ist die Sophienkathedrale in Nowgorod?', 'mention': 'Sophienkathedrale'}]	en	de
Q305419_0	Q305419	['Place of worship']	What is the significance of the Basilica of Our Lady of Guadalupe in Mexican culture?	[{'translation': 'Welche Bedeutung hat die Basilika Unserer Lieben Frau von Guadalupe in der mexikanischen Kultur?', 'mention': 'Basilika Unserer Lieben Frau von Guadalupe'}]	en	de
Q305419_1	Q305419	['Place of worship']	What type of building is the Basilica of Our Lady of Guadalupe?	[{'translation': 'Welche Art von Gebäude ist das Basilika Unserer Lieben Frau von Guadalupe?', 'mention': 'Basilika Unserer Lieben Frau von Guadalupe'}, {'translation': 'Welche Art von Gebäude ist die Basilika Unserer Lieben Frau von Guadalupe?', 'mention': 'Basilika Unserer Lieben Frau von Guadalupe'}]	en	de
Q305419_2	Q305419	['Place of worship']	How many times has the Basilica of Our Lady of Guadalupe been rebuilt?	[{'translation': 'Wie oft wurde das Basilika Unserer Lieben Frau von Guadalupe wieder aufgebaut?', 'mention': 'Basilika Unserer Lieben Frau von Guadalupe'}, {'translation': 'Wie oft wurde die Basilika Unserer Lieben Frau von Guadalupe wieder aufgebaut?', 'mention': 'Basilika Unserer Lieben Frau von Guadalupe'}, {'translation': 'Wie oft wurde die Basilika Unserer Lieben Frau von Guadalupe umgebaut?', 'mention': 'Basilika Unserer Lieben Frau von Guadalupe'}]	en	de
Q310549_0	Q310549	['Musical work']	When was the Mass in B minor composed?	[{'translation': 'Wann wurde die Messe in h-Moll komponiert?', 'mention': 'Messe in h-Moll'}, {'translation': 'Wann wurde die h-Moll-Messe komponiert?', 'mention': 'h-Moll-Messe'}]	en	de
Q310549_1	Q310549	['Musical work']	Who composed the Mass in B minor?	[{'translation': 'Wer komponierte die Messe in h-Moll?', 'mention': 'Messe in h-Moll'}, {'translation': 'Wer hat die h-Moll-Messe komponiert?', 'mention': 'h-Moll-Messe'}, {'translation': 'Wer komponierte die h-Moll-Messe?', 'mention': 'h-Moll-Messe'}]	en	de
Q310549_2	Q310549	['Musical work']	What type of musical work is the Mass in B minor?	[{'translation': 'Welche Art von musikalischem Werk ist die Messe in h-Moll?', 'mention': 'Messe in h-Moll'}, {'translation': 'Was für eine Art von musikalischem Werk ist die Messe in h-Moll?', 'mention': 'Messe in h-Moll'}, {'translation': 'Um welche Art von Musikwerk handelt es sich bei der h-Moll-Messe?', 'mention': 'h-Moll-Messe'}, {'translation': 'Welche Art von musikalischem Werk ist die h-Moll-Messe?', 'mention': 'h-Moll-Messe'}]	en	de
Q312491_0	Q312491	['Person']	When did John Malalas live and write his chronicles?	[{'translation': 'Wann hat Johannes Malalas gelebt und seine Chroniken geschrieben?', 'mention': 'Johannes Malalas'}]	en	de
Q312491_1	Q312491	['Person']	What nationality was John Malalas?	[{'translation': 'Welche Nationalität hatte Johannes Malalas?', 'mention': 'Johannes Malalas'}]	en	de
Q312491_2	Q312491	['Person']	What is John Malalas most known for in the field of history?	[{'translation': 'Wofür ist Johannes Malalas auf dem Gebiet der Geschichte am bekanntesten?', 'mention': 'Johannes Malalas'}]	en	de
Q3133305_0	Q3133305	['Musical work']	How many instruments are typically involved in performing the String Quartet No. 21?	[{'translation': 'Wie viele Instrumente sind typischerweise an der Aufführung des 21. Streichquartett beteiligt?', 'mention': '21. Streichquartett'}, {'translation': 'Wie viele Instrumente sind normalerweise an der Aufführung des Streichquartetts Nr. 21 beteiligt?', 'mention': 'Streichquartetts Nr. 21'}, {'translation': 'Wie viele Instrumente sind typischerweise an der Aufführung des Streichquartett Nr. 21 beteiligt?', 'mention': 'Streichquartett Nr. 21'}]	en	de
Q3133305_1	Q3133305	['Musical work']	What is the genre of the String Quartet No. 21?	[{'translation': 'Was ist das Genre des 21. Streichquartett?', 'mention': '21. Streichquartett'}, {'translation': 'Was ist das Genre des Streichquartetts Nr. 21?', 'mention': 'Streichquartetts Nr. 21'}, {'translation': 'Was ist das Genre des Streichquartett Nr. 21?', 'mention': 'Streichquartett Nr. 21'}]	en	de
Q3133305_2	Q3133305	['Musical work']	Which composer is known for composing the String Quartet No. 21?	[{'translation': 'Welcher Komponist ist dafür bekannt, das 21. Streichquartett zu komponieren?', 'mention': '21. Streichquartett'}, {'translation': 'Welcher Komponist ist bekannt für die Komposition des Streichquartetts Nr. 21?', 'mention': 'Streichquartetts Nr. 21'}, {'translation': 'Welcher Komponist ist dafür bekannt, das Streichquartett Nr. 21 zu komponieren?', 'mention': 'Streichquartett Nr. 21'}]	en	de
Q31416_0	Q31416	['Place of worship', 'Landmark']	Is the Antoniev Monastery a popular place of worship?	[{'translation': 'Ist das Antoniuskloster ein beliebter Ort der Anbetung?', 'mention': 'Antoniuskloster'}, {'translation': 'Ist das Antoniev-Kloster ein beliebter Ort der Anbetung?', 'mention': 'Antoniev-Kloster'}, {'translation': 'Ist das Antoniev -Kloster ein beliebter Anbetungsort?', 'mention': 'Antoniev -Kloster'}]	en	de
Q31416_1	Q31416	['Place of worship', 'Landmark']	Where is the Antoniev Monastery located?	[{'translation': 'Wo befindet sich das Antoniuskloster?', 'mention': 'Antoniuskloster'}]	en	de
Q31416_2	Q31416	['Place of worship', 'Landmark']	What is the significance of the Antoniev Monastery?	[{'translation': 'Was ist die Bedeutung des Antoniusklosters?', 'mention': 'Antoniuskloster'}, {'translation': 'Was ist die Bedeutung des Antoniuskloster?', 'mention': 'Antoniuskloster'}]	en	de
Q3206562_0	Q3206562	['Movie']	Who is the main actor or actress in Slave Girl?	[{'translation': 'Wer ist der Hauptdarsteller oder die Hauptdarstellerin in Die falsche Sklavin?', 'mention': 'Die falsche Sklavin'}, {'translation': 'Wer ist der Hauptdarsteller oder die Hauptdarstellerin in die falsche Sklavin?', 'mention': 'Die falsche Sklavin'}]	en	de
Q3206562_1	Q3206562	['Movie']	What year was the movie Slave Girl released?	[{'translation': 'In welchem Jahr wurde der Film Die falsche Sklavin veröffentlicht?', 'mention': 'Die falsche Sklavin'}, {'translation': 'In welchem Jahr wurde der Film die falsche Sklavin veröffentlicht?', 'mention': 'Die falsche Sklavin'}]	en	de
Q3206562_2	Q3206562	['Movie']	Which genre does the movie Slave Girl belong to?	[{'translation': 'Zu welchem Genre gehört der Film Die falsche Sklavin?', 'mention': 'Die falsche Sklavin'}, {'translation': 'Welchem Genre ist der Film die falsche Sklavin zuzuordnen?', 'mention': 'Die falsche Sklavin'}]	en	de
Q3224451_0	Q3224451	['Artwork']	Is The Stationmaster based on a true story?	[{'translation': 'Basiert Der Postmeister auf einer wahren Geschichte?', 'mention': 'Der Postmeister'}]	en	de
Q3224451_1	Q3224451	['Artwork']	What is the genre of The Stationmaster?	[{'translation': 'Was ist das Genre von Der Postmeister?', 'mention': 'Der Postmeister'}]	en	de
Q3224451_2	Q3224451	['Artwork']	How would you describe The Stationmaster in one word?	[{'translation': 'Wie würden Sie Der Postmeister in einem Wort beschreiben?', 'mention': 'Der Postmeister'}]	en	de
Q3233113_0	Q3233113	['Movie']	Can you provide a brief summary of the plot of Warriors of Virtue?	[{'translation': 'Können Sie eine kurze Zusammenfassung der Handlung von Die Krieger des Tao-Universums geben?', 'mention': 'Die Krieger des Tao-Universums'}, {'translation': 'Können Sie die Handlung von Warriors of Virtue kurz zusammenfassen?', 'mention': 'Warriors of Virtue'}]	en	de
Q3233113_1	Q3233113	['Movie']	When was the film Warriors of Virtue released?	[{'translation': 'Wann wurde der Film Die Krieger des Tao-Universums veröffentlicht?', 'mention': 'Die Krieger des Tao-Universums'}]	en	de
Q3233113_2	Q3233113	['Movie']	What is the genre of the movie Warriors of Virtue?	[{'translation': 'Was ist das Genre des Films Die Krieger des Tao-Universums?', 'mention': 'Die Krieger des Tao-Universums'}]	en	de
Q3246973_0	Q3246973	['Food']	What are some popular dishes that include black-eyed peas?	[{'translation': 'Was sind einige beliebte Gerichte, zu denen Schwarzaugenbohnen gehören?', 'mention': 'Schwarzaugenbohnen'}, {'translation': 'Was sind einige beliebte Gerichte, zu der Augenbohne gehören?', 'mention': 'Augenbohne'}]	en	de
Q3246973_1	Q3246973	['Food']	Are black-eyed peas a type of cowpea?	[{'translation': 'Sind Schwarzaugenbohnen eine Art von Kuhbohnen?', 'mention': 'Schwarzaugenbohne'}, {'translation': 'Sind die Augenbohnen eine Art von Kuherbsen?', 'mention': 'Augenbohnen'}, {'translation': 'Sind Vigna unguiculata subsp. unguiculata eine Art von Kuherbsen?', 'mention': 'Vigna unguiculata subsp. unguiculata'}]	en	de
Q3246973_2	Q3246973	['Food']	How are black-eyed peas typically prepared?	[{'translation': 'Wie werden Schwarzaugenbohnen typischerweise zubereitet?', 'mention': 'Schwarzaugenbohne'}, {'translation': 'Wie werden die Augenbohnen typischerweise zubereitet?', 'mention': 'Augenbohnen'}, {'translation': 'Wie werden Vigna unguiculata subsp. unguiculata typischerweise zubereitet?', 'mention': 'Vigna unguiculata subsp. unguiculata'}]	en	de
Q3323634_0	Q3323634	['Food']	Can fresh cheese be easily made at home?	[{'translation': 'Lässt sich Frischkäse problemlos zu Hause herstellen?', 'mention': 'Frischkäse'}, {'translation': 'Kann Frischkäse leicht zu Hause zubereitet werden?', 'mention': 'Frischkäse'}]	en	de
Q3323634_1	Q3323634	['Food']	How long does it take to make fresh cheese from start to finish?	[{'translation': 'Wie lange dauert die Herstellung von Frischkäse vom Anfang bis zum Ende?', 'mention': 'Frischkäse'}, {'translation': 'Wie lange dauert es, Frischkäse von Anfang bis Ende herzustellen?', 'mention': 'Frischkäse'}]	en	de
Q3323634_2	Q3323634	['Food']	What are some common culinary uses for fresh cheese?	[{'translation': 'Welche typischen kulinarischen Verwendungszwecke gibt es für Frischkäse?', 'mention': 'Frischkäse'}, {'translation': 'Was sind einige häufige kulinarische Verwendungen für Frischkäse?', 'mention': 'Frischkäse'}, {'translation': 'Was sind einige häufige kulinarische Verwendungszwecke für Frischkäse?', 'mention': 'Frischkäse'}]	en	de
Q333280_0	Q333280	['Musical work']	How many beats are in each measure of the Minuet in G major?	[{'translation': 'Wie viele Schläge gibt es in jedem Takt des Menuett G-Dur?', 'mention': 'Menuett G-Dur'}, {'translation': 'Wie viele Schläge gibt es in jedem Takt der Menuett G-Dur?', 'mention': 'Menuett G-Dur'}]	en	de
Q333280_1	Q333280	['Musical work']	Who is the composer of the Minuet in G major?	[{'translation': 'Wer ist der Komponist des Menuett G-Durs?', 'mention': 'Menuett G-Dur'}, {'translation': 'Wer ist der Komponist des Menuett G-Dur?', 'mention': 'Menuett G-Dur'}]	en	de
Q333280_2	Q333280	['Musical work']	What key is the Minuet in G major written in?	[{'translation': 'In welcher Tonart ist das Menuett G-Dur geschrieben?', 'mention': 'Menuett G-Dur'}, {'translation': 'In welcher Tonart ist die Menuett G-Dur geschrieben?', 'mention': 'Menuett G-Dur'}]	en	de
Q334199_0	Q334199	['Place of worship']	In which country is the Monastery of Saint-Paul-de-Mausole found?	[{'translation': 'In welchem Land befindet sich das Abtei Saint-Paul-de-Mausole?', 'mention': 'Abtei Saint-Paul-de-Mausole'}, {'translation': 'In welchem Land befindet sich die Abtei Saint-Paul-de-Mausole?', 'mention': 'Abtei Saint-Paul-de-Mausole'}]	en	de
Q334199_1	Q334199	['Place of worship']	What type of building is the Monastery of Saint-Paul-de-Mausole?	[{'translation': 'Welche Art von Gebäude ist das Abtei Saint-Paul-de-Mausole?', 'mention': 'Abtei Saint-Paul-de-Mausole'}, {'translation': 'Welche Art von Gebäude ist die Abtei Saint-Paul-de-Mausole?', 'mention': 'Abtei Saint-Paul-de-Mausole'}]	en	de
Q334199_2	Q334199	['Place of worship']	What is the name of the region where the Monastery of Saint-Paul-de-Mausole is situated?	[{'translation': 'Wie heißt die Region, in der sich das Abtei Saint-Paul-de-Mausole befindet?', 'mention': 'Abtei Saint-Paul-de-Mausole'}, {'translation': 'Wie heißt die Region, in der sich die Abtei Saint-Paul-de-Mausole befindet?', 'mention': 'Abtei Saint-Paul-de-Mausole'}]	en	de
Q3369166_0	Q3369166	['Movie']	What country is the film Can You Whistle, Johanna? from?	[{'translation': 'Aus welchem Land kommt der Film Kannst Du pfeifen, Johanna?', 'mention': 'Kannst Du pfeifen, Johanna'}, {'translation': 'Aus welchem Land kommt der Film Kannst Du pfeifen, Johanna??', 'mention': 'Kannst Du pfeifen, Johanna?'}]	en	de
Q3369166_1	Q3369166	['Movie']	When was the movie Can You Whistle, Johanna? released?	[{'translation': 'Wann wurde der Film Kannst Du pfeifen, Johanna veröffentlicht?', 'mention': 'Kannst Du pfeifen, Johanna'}, {'translation': 'Wann wurde der Film Kannst Du pfeifen, Johanna? veröffentlicht?', 'mention': 'Kannst Du pfeifen, Johanna?'}]	en	de
Q3369166_2	Q3369166	['Movie']	Who is Johanna in the movie Can You Whistle, Johanna??	[{'translation': 'Wer ist Johanna in dem Film Kannst Du pfeifen, Johanna?', 'mention': 'Kannst Du pfeifen, Johanna'}, {'translation': 'Wer ist Johanna in dem Film Kannst Du pfeifen, Johanna??', 'mention': 'Kannst Du pfeifen, Johanna?'}]	en	de
Q347374_0	Q347374	['Person']	Who is the son of Prince Gustaf Adolf, Duke of Västerbotten?	[{'translation': 'Wer ist der Sohn von Gustav Adolf Erbprinz von Schweden?', 'mention': 'Gustav Adolf Erbprinz von Schweden'}, {'translation': 'Wer ist der Sohn von Prinz Gustaf Adolf, Herzog von Västerbotten?', 'mention': 'Prinz Gustaf Adolf, Herzog von Västerbotten'}]	en	de
Q347374_1	Q347374	['Person']	Who was the father of Prince Gustaf Adolf, Duke of Västerbotten?	[{'translation': 'Wer war der Vater von Prinz Gustaf Adolf, Herzog von Västerbotten', 'mention': 'Prinz Gustaf Adolf, Herzog von Västerbotten'}, {'translation': 'Wer war der Vater von Prinz Gustaf Adolf, Herzog von Västerbotten?', 'mention': 'Prinz Gustaf Adolf, Herzog von Västerbotten'}]	en	de
Q347374_2	Q347374	['Person']	When was Prince Gustaf Adolf, Duke of Västerbotten born?	[{'translation': 'Wann wurde Prinz Gustaf Adolf, Herzog von Västerbotten, geboren?', 'mention': 'Prinz Gustaf Adolf, Herzog von Västerbotten'}]	en	de
Q3485664_0	Q3485664	['Musical work']	What is the opus number of Six Pieces for Piano, Op. 118?	[{'translation': 'Wie lautet die Opuszahl von Sechs Stücke für Klavier, Op. 118?', 'mention': 'Sechs Stücke für Klavier, Op. 118'}]	en	de
Q3485664_1	Q3485664	['Musical work']	Who composed the Six Pieces for Piano, Op. 118?	[{'translation': 'Wer komponierte die Sechs Stücke für Klavier, Op. 118?', 'mention': 'Sechs Stücke für Klavier, Op. 118?'}, {'translation': 'Wer komponierte die 6 Klavierstücke?', 'mention': '6 Klavierstücke'}]	en	de
Q3485664_2	Q3485664	['Musical work']	How many pieces are included in Six Pieces for Piano, Op. 118?	[{'translation': 'Wie viele Stücke sind in Sechs Stücke für Klavier, Op. 118?', 'mention': 'Sechs Stücke für Klavier, Op. 118?'}, {'translation': 'Wie viel Stücke sind in den sechs Klavierstücken, Op. 118 enthalten?', 'mention': 'Wie viel Stücke sind in den sechs Klavierstücken, Op. 118 enthalten?'}, {'translation': 'Wie viele Stücke sind in 6 Klavierstücke enthalten?', 'mention': '6 Klavierstücke'}]	en	de
Q3620148_0	Q3620148	['Place of worship']	Who was allowed to enter the Holy of Holies?	[{'translation': 'Wer durfte Allerheiligstes betreten?', 'mention': 'Allerheiligstes'}]	en	de
Q3620148_1	Q3620148	['Place of worship']	Where was the Holy of Holies located?	[{'translation': 'Wo befand sich das Allerheiligstes?', 'mention': 'Allerheiligstes'}]	en	de
Q3620148_2	Q3620148	['Place of worship']	What was the purpose of the Holy of Holies in worship?	[{'translation': 'Welchen Zweck hatte das Allerheiligstes in der Anbetung?', 'mention': 'Allerheiligstes'}]	en	de
Q372907_0	Q372907	['Musical work']	Can you provide any details about the Violin Concerto?	[{'translation': 'Können Sie Einzelheiten zum Violinkonzert nennen?', 'mention': 'Violinkonzert'}, {'translation': 'Können Sie irgendwelche Details über das Violinkonzert angeben?', 'mention': 'Violinkonzert'}]	en	de
Q372907_1	Q372907	['Musical work']	What type of musical work is the Violin Concerto?	[{'translation': 'Um welche Art von Musikwerk handelt es sich beim Violinkonzert?', 'mention': 'Violinkonzert'}, {'translation': 'Welche Art von musikalischem Werk ist das Violinkonzert?', 'mention': 'Violinkonzert'}, {'translation': 'Welche Art von musikalischer Arbeit ist das Violinkonzert?', 'mention': 'Violinkonzert'}]	en	de
