id	wikidata_id	entity_types	source	targets	source_locale	target_locale
Q547209_2	Q547209	['Movie']	What is the genre of the movie Silk Stockings?	[{'translation': 'Was ist das Genre des Films Seidenstrümpfe?', 'mention': 'Seidenstrümpfe'}]	en	de
Q550346_0	Q550346	['Landmark']	What architectural style is the Cathedral of Saint Demetrius?	[{'translation': 'Welcher architektonische Stil ist die Demetrios-Kathedrale?', 'mention': 'Demetrios-Kathedrale'}]	en	de
Q550346_1	Q550346	['Landmark']	When was the Cathedral of Saint Demetrius built?	[{'translation': 'Wann wurde die Demetrios-Kathedrale gebaut?', 'mention': 'Demetrios-Kathedrale'}]	en	de
Q550346_2	Q550346	['Landmark']	Where is the Cathedral of Saint Demetrius located?	[{'translation': 'Wo befindet sich die Demetrios-Kathedrale?', 'mention': 'Demetrios-Kathedrale'}]	en	de
Q5531958_0	Q5531958	['Book']	Who is responsible for implementing the guidelines outlined in the General Instruction of the Roman Missal?	[{'translation': 'Wer ist für die Umsetzung der Richtlinien verantwortlich, die in der allgemeinen Einführung in das Römische Messbuch dargelegt werden?', 'mention': 'allgemeinen Einführung in das Römische Messbuch'}, {'translation': 'Wer ist für die Umsetzung der in der Allgemeinen Einführung in das Römische Messbuch dargelegten Richtlinien verantwortlich?', 'mention': 'Allgemeinen Einführung in das Römische Messbuch'}]	en	de
Q5531958_1	Q5531958	['Book']	How does the General Instruction of the Roman Missal govern the celebration of Mass?	[{'translation': 'Wie regelt die Allgemeine Einführung in das Römische Messbuch die Feier der Messe?', 'mention': 'Allgemeine Einführung in das Römische Messbuch'}]	en	de
Q5531958_2	Q5531958	['Book']	What is the significance of the General Instruction of the Roman Missal in the Roman Rite?	[{'translation': 'Welche Bedeutung hat die Allgemeine Einführung in das Römische Messbuch im römischen Ritus?', 'mention': 'Allgemeine Einführung in das Römische Messbuch'}]	en	de
Q56284270_0	Q56284270	['TV series']	Where can viewers watch episodes of My Lottery Dream Home?	[{'translation': 'Wo können sich die Zuschauer Episoden von Jackpot! - Hauptpreis Traumhaus ansehen?', 'mention': 'Jackpot! - Hauptpreis Traumhaus'}, {'translation': 'Wo können Zuschauer Folgen von My Lottery Dream Home sehen?', 'mention': 'My Lottery Dream Home'}, {'translation': 'Wo können Zuschauer Episoden von My Lottery Dream Home sehen?', 'mention': 'My Lottery Dream Home'}]	en	de
Q56284270_1	Q56284270	['TV series']	Who hosts the American reality TV series My Lottery Dream Home?	[{'translation': 'Wer moderiert die amerikanische Reality-TV-Serie Jackpot! - Hauptpreis Traumhaus?', 'mention': 'Jackpot! - Hauptpreis Traumhaus'}, {'translation': 'Wer moderiert die amerikanische Reality-TV-Serie My Lottery Dream Home?', 'mention': 'My Lottery Dream Home'}]	en	de
Q56284270_2	Q56284270	['TV series']	How many seasons of My Lottery Dream Home have been aired?	[{'translation': 'Wie viele Staffeln von Jackpot! - Hauptpreis Traumhaus wurden ausgestrahlt?', 'mention': 'Jackpot! - Hauptpreis Traumhaus'}, {'translation': 'Wie viele Staffeln von My Lottery Dream Home wurden ausgestrahlt?', 'mention': 'My Lottery Dream Home'}, {'translation': 'Wie viele Staffeln vonJackpot! - Hauptpreis Traumhaus___ wurden ausgestrahlt?', 'mention': 'Jackpot! - Hauptpreis Traumhaus'}]	en	de
Q571559_0	Q571559	['Person']	Where was Rudolph, Duke of Lorraine from?	[{'translation': 'Woher kam Rudolf?', 'mention': 'Rudolf'}]	en	de
Q571559_1	Q571559	['Person']	What role did Rudolph, Duke of Lorraine hold?	[{'translation': 'Welche Rolle hatte Rudolf inne?', 'mention': 'Rudolf'}, {'translation': 'Welche Stellung hatte Rudolf?', 'mention': 'Rudolf'}]	en	de
Q571559_2	Q571559	['Person']	When did Rudolph, Duke of Lorraine live?	[{'translation': 'Wann lebte Rudolf?', 'mention': 'Rudolf'}]	en	de
Q578262_0	Q578262	['Musical work']	When was the Scythian Suite first performed?	[{'translation': 'Wann wurde die Skythische Suite zum ersten Mal aufgeführt?', 'mention': 'Skythische Suite'}]	en	de
Q578262_1	Q578262	['Musical work']	Who composed the Scythian Suite?	[{'translation': 'Wer hat die Skythische Suite komponiert?', 'mention': 'Skythische Suite'}]	en	de
Q578262_2	Q578262	['Musical work']	How many movements are in the Scythian Suite?	[{'translation': 'Wie viele Bewegungen gibt es in der Skythische Suite?', 'mention': 'Skythische Suite'}, {'translation': 'Wie viele Sätze enthält die Skythische Suite?', 'mention': 'Skythische Suite'}]	en	de
Q59242746_0	Q59242746	['TV series']	Is Motown Magic an Australian-American collaboration?	[{'translation': 'Ist Motown Magic eine australisch-amerikanische Zusammenarbeit?', 'mention': 'Motown Magic'}, {'translation': 'Ist Magie in Motown eine australisch-amerikanische Zusammenarbeit?', 'mention': 'Magie in Motown'}]	en	de
Q59242746_1	Q59242746	['TV series']	What type of TV series is Motown Magic?	[{'translation': 'Welche Art von TV-Serie ist Motown Magic?', 'mention': 'Motown Magic'}, {'translation': 'Welche Art von TV-Serie ist Magie in Motown?', 'mention': 'Magie in Motown'}]	en	de
Q59242746_2	Q59242746	['TV series']	Where is Motown Magic produced?	[{'translation': 'Wo wird Motown Magic produziert?', 'mention': 'Motown Magic'}, {'translation': 'Wo wurde Magie in Motown produziert?', 'mention': 'Magie in Motown'}, {'translation': 'Wo wird Magie in Motown produziert?', 'mention': 'Magie in Motown'}]	en	de
Q59543_0	Q59543	['Movie']	What genre is the movie Son of the Bride?	[{'translation': 'Welches Genre ist der Film Der Sohn der Braut?', 'mention': 'Der Sohn der Braut'}]	en	de
Q59543_1	Q59543	['Movie']	When was Son of the Bride released?	[{'translation': 'Wann wurde Der Sohn der Braut veröffentlicht?', 'mention': 'Der Sohn der Braut'}]	en	de
Q59543_2	Q59543	['Movie']	Can you provide a brief synopsis of the film Son of the Bride?	[{'translation': 'Können Sie eine kurze Zusammenfassung des Films Der Sohn der Braut abgeben?', 'mention': 'Der Sohn der Braut'}, {'translation': 'Können Sie eine kurze Zusammenfassung des Films Der Sohn der Braut geben?', 'mention': 'Der Sohn der Braut'}, {'translation': 'Können Sie eine kurze Zusammenfassung des Films Der Sohn der Braut zur Verfügung stellen?', 'mention': 'Der Sohn der Braut'}]	en	de
Q597114_0	Q597114	['Artwork']	Who painted the Death of the Virgin?	[{'translation': 'Wer hat Tod Mariä gemalt?', 'mention': 'Tod Mariä'}, {'translation': ': Wer hat den Tod Mariä gemalt?', 'mention': 'Tod Mariä'}, {'translation': 'Wer hat den Tod Mariä gemalt?', 'mention': 'Tod Mariä'}]	en	de
Q602358_0	Q602358	['Book']	How many volumes does the Brockhaus and Efron Encyclopedic Dictionary consist of?	[{'translation': 'Aus wie vielen Bänden besteht das Brockhaus-Efron?', 'mention': 'Brockhaus-Efron'}, {'translation': 'Aus wie vielen Bänden besteht dasEnzyklopädisches Wörterbuch von Brockhaus und Efron?', 'mention': 'Enzyklopädisches Wörterbuch von Brockhaus und Efron'}, {'translation': 'Aus wie vielen Bänden besteht die Brockhaus-Efron-Enzyklopädie', 'mention': 'Brockhaus-Efron-Enzyklopädie'}]	en	de
Q602358_1	Q602358	['Book']	How would you describe the content of the Brockhaus and Efron Encyclopedic Dictionary?	[{'translation': 'Wie würden Sie den Inhalt des Brockhaus-Efron beschreiben?', 'mention': 'Brockhaus-Efron'}, {'translation': 'Wie würden Sie den Inhalt des Enzyklopädisches Wörterbuch von Brockhaus und Efron beschreiben?', 'mention': 'Enzyklopädisches Wörterbuch von Brockhaus und Efron'}, {'translation': 'Wie würde man den Inhalt der Brockhaus-Efron-Enzyklopädie beschreiben?', 'mention': 'Brockhaus-Efron-Enzyklopädie'}]	en	de
Q602358_2	Q602358	['Book']	In which language is the Brockhaus and Efron Encyclopedic Dictionary written?	[{'translation': 'In welcher Sprache ist das Brockhaus-Efron geschrieben?', 'mention': 'Brockhaus-Efron'}, {'translation': 'In welcher Sprache ist das Enzyklopädisches Wörterbuch von Brockhaus und Efron geschrieben?', 'mention': 'Enzyklopädisches Wörterbuch von Brockhaus und Efron'}, {'translation': 'In welcher Sprache ist die Brockhaus-Efron-Enzyklopädie geschrieben?', 'mention': 'Brockhaus-Efron-Enzyklopädie'}]	en	de
Q605249_0	Q605249	['Artwork', 'Book']	What type of artwork is Do Androids Dream of Electric Sheep??	[{'translation': 'Welche Art von Kunstwerk ist Träumen Androiden von elektrischen Schafen??', 'mention': 'Träumen Androiden von elektrischen Schafen?'}, {'translation': 'Welche Art von Kunstwerk ist Träumen Androiden von elektrischen Schafen?', 'mention': 'Träumen Androiden von elektrischen Schafen?'}, {'translation': 'Welche Art von künstlerischen Stils ist Träumen Androiden von elektrischen Schafen gemacht?', 'mention': 'Träumen Androiden von elektrischen Schafen'}]	en	de
Q605249_1	Q605249	['Artwork', 'Book']	In which year was Do Androids Dream of Electric Sheep? published?	[{'translation': 'In welchem Jahr entstand Träumen Androiden von elektrischen Schafen? veröffentlicht?', 'mention': 'Träumen Androiden von elektrischen Schafen?'}, {'translation': 'In welchem Jahr wurde Träumen Androiden von elektrischen Schafen veröffentlicht?', 'mention': 'Träumen Androiden von elektrischen Schafen?'}]	en	de
Q605249_2	Q605249	['Artwork', 'Book']	Can androids in Do Androids Dream of Electric Sheep? experience dreams about electric sheep?	[{'translation': 'Können Androiden in Träumen Androiden von elektrischen Schafen? träume von elektrischen Schafen erleben?', 'mention': 'Träumen Androiden von elektrischen Schafen?'}, {'translation': 'Können Androiden in Träumen Androiden von elektrischen Schafen Träume von elektrischen Schafen erleben?', 'mention': 'Träumen Androiden von elektrischen Schafen?'}]	en	de
Q6099564_0	Q6099564	['TV series']	When was Ivor the Engine first aired?	[{'translation': 'Wann wurde Die kleine Lok Ivor zum ersten Mal ausgestrahlt?', 'mention': 'Die kleine Lok Ivor'}, {'translation': 'Wann wurde Die kleine Lok Ivor erstmals ausgelstrahlt?', 'mention': 'Die kleine Lok Ivor'}]	en	de
Q6099564_1	Q6099564	['TV series']	How many seasons of Ivor the Engine are there?	[{'translation': 'Wie viele Staffeln von Die kleine Lok Ivor gibt es?', 'mention': 'Die kleine Lok Ivor'}]	en	de
Q6099564_2	Q6099564	['TV series']	Who created Ivor the Engine?	[{'translation': 'Wer hat Die kleine Lok Ivor geschaffen?', 'mention': 'Die kleine Lok Ivor'}, {'translation': 'Wer hat Die kleine Lok Ivor erschaffen?', 'mention': 'Die kleine Lok Ivor'}, {'translation': 'Wer hat Die kleine Lok Ivor erfunden?', 'mention': 'Die kleine Lok Ivor'}]	en	de
Q618345_0	Q618345	['Food']	Can apple sauce be used in baking recipes?	[{'translation': 'Kann Apfelmus in Backrezepten verwendet werden?', 'mention': 'Apfelmus'}]	en	de
Q618345_1	Q618345	['Food']	What are some popular uses for apple sauce?	[{'translation': 'Was sind einige beliebte Verwendungen für Apfelmus?', 'mention': 'Apfelmus'}]	en	de
Q618345_2	Q618345	['Food']	Is apple sauce a healthy snack option?	[{'translation': 'Ist Apfelmus eine gesunde Snack-Option?', 'mention': 'Apfelmus'}]	en	de
Q623153_0	Q623153	['Artwork']	In what year was Theses on Feuerbach written?	[{'translation': 'In welchem Jahr wurden die Thesen über Feuerbach geschrieben?', 'mention': 'Thesen über Feuerbach'}, {'translation': 'In welchem Jahr wurde die Thesen über Feuerbach geschrieben?', 'mention': 'Thesen über Feuerbach'}]	en	de
Q623153_1	Q623153	['Artwork']	Who is the author of the literary work Theses on Feuerbach?	[{'translation': 'Wer ist der Autor des literarischen Werks Thesen zu Feuerbach?', 'mention': 'Thesen zu Feuerbach'}, {'translation': 'Wer ist der Autor des literarischen Werks Thesen über Feuerbach?', 'mention': 'Thesen über Feuerbach'}]	en	de
Q623153_2	Q623153	['Artwork']	How many theses are included in Theses on Feuerbach?	[{'translation': 'Wie viele Thesen sind in Thesen zu Feuerbach enthalten?', 'mention': 'Thesen zu Feuerbach'}, {'translation': 'Wie viele Thesen sind in den Thesen zu Feuerbach enthalten?', 'mention': 'Thesen zu Feuerbach'}, {'translation': 'Wie viele Thesen sind in den Thesen über Feuerbach enthalten?', 'mention': 'Thesen über Feuerbach'}, {'translation': 'Wie viele Thesen sind in Thesen über Feuerbach enthalten?', 'mention': 'Thesen über Feuerbach'}]	en	de
Q62401_0	Q62401	['Person']	How long did Duke George of Oldenburg live?	[{'translation': 'Wie lange lebte Georg von Oldenburg?', 'mention': 'Georg von Oldenburg'}]	en	de
Q62401_1	Q62401	['Person']	When was Duke George of Oldenburg born?	[{'translation': 'Wann wurde Georg von Oldenburg geboren?', 'mention': 'Georg von Oldenburg'}]	en	de
Q62401_2	Q62401	['Person']	What was Duke George of Oldenburg's nationality?	[{'translation': 'Was war die Nationalität von Georg von Oldenburg?', 'mention': 'Georg von Oldenburg'}, {'translation': 'Welche Nationalität hatte Georg von Oldenburg?', 'mention': 'Georg von Oldenburg'}]	en	de
Q62483_0	Q62483	['Person']	Where was William, Duke of Jülich-Cleves-Berg from?	[{'translation': 'Woher kam Wilhelm der Reiche?', 'mention': 'Wilhelm der Reiche'}, {'translation': 'Woher stammte Wilhelm der Reiche?', 'mention': 'Wilhelm der Reiche'}]	en	de
Q62483_1	Q62483	['Person']	What was the title held by William, Duke of Jülich-Cleves-Berg?	[{'translation': 'Wie lautete der Titel von Wilhelm der Reiche?', 'mention': 'Wilhelm der Reiche'}, {'translation': 'Welchen Titel hatte Wilhelm der Reiche?', 'mention': 'Wilhelm der Reiche'}]	en	de
Q62483_2	Q62483	['Person']	In what years did William, Duke of Jülich-Cleves-Berg rule over Jülich-Cleves-Berg?	[{'translation': 'In welchen Jahren herrschte Wilhelm der Reiche, über Jülich-Cleves-Berg?', 'mention': 'Wilhelm der Reiche'}, {'translation': 'In welchen Jahren regierte Wilhelm der Reiche über Jülich-Cleves-Berg?', 'mention': 'Wilhelm der Reiche'}]	en	de
Q6316745_0	Q6316745	['Person', 'Fictional entity']	Is the Fairy Godmother a villain or a hero in Shrek?	[{'translation': 'Ist die Fee Patin ein Bösewicht oder ein Held in Shrek?', 'mention': 'Fee Patin'}, {'translation': 'Ist die Fee Patin in Shrek eine Bösewichtin oder eine Heldin?', 'mention': 'Fee Patin'}, {'translation': 'Ist die Fee Patin eine Bösewichtin oder eine Heldin in Shrek?', 'mention': 'Fee Patin'}]	en	de
Q6316745_1	Q6316745	['Person', 'Fictional entity']	What role does the Fairy Godmother play in the Shrek movies?	[{'translation': 'Welche Rolle spielt die Fee Patin in den Shrek-Filmen?', 'mention': 'Fee Patin'}]	en	de
Q6316745_2	Q6316745	['Person', 'Fictional entity']	What magical powers does the Fairy Godmother have in Shrek?	[{'translation': 'Welche magischen Kräfte hat die Fee Patin in Shrek?', 'mention': 'Fee Patin'}]	en	de
Q634325_0	Q634325	['Movie']	Who are the main actors in The Rare Breed?	[{'translation': 'Wer sind die Hauptdarsteller in Rancho River?', 'mention': 'Rancho River'}]	en	de
Q634325_1	Q634325	['Movie']	What is the genre of the film called The Rare Breed?	[{'translation': 'Was ist das Genre des Films namens Rancho River?', 'mention': 'Rancho River'}]	en	de
Q634325_2	Q634325	['Movie']	When was the movie The Rare Breed released?	[{'translation': 'Wann wurde der Film Rancho River veröffentlicht?', 'mention': 'Rancho River'}, {'translation': 'Wann wurde der Film Rancho River veröffentlich?', 'mention': 'Rancho River'}]	en	de
Q639184_0	Q639184	['Fictional entity']	What is the name of the leader of the Seven Dwarfs?	[{'translation': 'Wie heißt der Anführer der Sieben Zwerge?', 'mention': 'Sieben Zwerge'}, {'translation': 'Wie heißt der Anführer der sieben Zwerge?', 'mention': 'sieben Zwerge'}]	en	de
Q639184_1	Q639184	['Fictional entity']	Who are the Seven Dwarfs in Snow White?	[{'translation': 'Wer sind die sieben Zwerge in Schneewittchen?', 'mention': 'Sieben Zwerge'}]	en	de
Q639184_2	Q639184	['Fictional entity']	In the story Snow White, what is the occupation of the Seven Dwarfs?	[{'translation': 'Welchen Beruf haben die sieben Zwerge in der Geschichte Schneewittchen?', 'mention': 'Sieben Zwerge'}, {'translation': 'Welche Tätigkeit haben die sieben Zwerge in Schneewittchen?', 'mention': 'die sieben Zwerge'}]	en	de
Q652046_0	Q652046	['Place of worship']	How old is the Muhammad Ali Mosque?	[{'translation': 'Wie alt ist die Muhammad-Ali-Moschee?', 'mention': 'Muhammad-Ali-Moschee'}]	en	de
Q652046_1	Q652046	['Place of worship']	What type of place is the Muhammad Ali Mosque?	[{'translation': 'Welche Art von Ort ist die Muhammad-Ali-Moschee?', 'mention': 'Muhammad-Ali-Moschee'}, {'translation': 'Was für ein Ort ist die Muhammad-Ali-Moschee?', 'mention': 'Muhammad-Ali-Moschee'}]	en	de
Q652046_2	Q652046	['Place of worship']	What is the significance of the Muhammad Ali Mosque?	[{'translation': 'was ist die Signifikanz von der Muhammad-Ali-Moschee?', 'mention': 'Muhammad-Ali-Moschee'}, {'translation': 'Welche Bedeutung hat die Muhammad-Ali-Moschee?', 'mention': 'Muhammad-Ali-Moschee'}, {'translation': 'Was ist die Bedeutung der Muhammad-Ali-Moschee?', 'mention': 'Muhammad-Ali-Moschee'}]	en	de
Q6553565_0	Q6553565	['Musical work']	How many movements are there in the Trumpet Concerto?	[{'translation': 'Wie viele Sätze gibt es im Trompetenkonzert?', 'mention': 'Trompetenkonzert'}, {'translation': 'Wie viele Bewegungen gibt es im Trompetenkonzert E-Dur?', 'mention': 'Trompetenkonzert E-Dur'}, {'translation': 'Wie viele Sätze hat das Trompetenkonzert?', 'mention': 'Trompetenkonzert'}, {'translation': 'Wie viele Sätze hat das Trompetenkonzert E-Dur?', 'mention': 'Trompetenkonzert E-Dur'}]	en	de
Q6553565_1	Q6553565	['Musical work']	What type of musical work is the Trumpet Concerto?	[{'translation': 'Welche Art von musikalischem Werk ist das Trompetenkonzert?', 'mention': 'Trompetenkonzert'}, {'translation': 'Welche Art von musikalischer Arbeit ist das Trompetenkonzert E-Dur?', 'mention': 'Trompetenkonzert E-Dur'}, {'translation': 'Welche Art von musikalischem Werk ist das Trompetenkonzert E-Dur?', 'mention': 'Trompetenkonzert E-Dur'}]	en	de
Q6553565_2	Q6553565	['Musical work']	When was the Trumpet Concerto composed?	[{'translation': 'Wann wurde das Trompetenkonzert komponiert?', 'mention': 'Trompetenkonzert'}, {'translation': 'Wann wurde das Trompetenkonzert E-Dur komponiert?', 'mention': 'Trompetenkonzert E-Dur'}]	en	de
Q664500_0	Q664500	['Musical work']	How would you describe Arnold Schoenberg's cantata A Survivor from Warsaw?	[{'translation': 'Wie würden Sie Arnold Schönbergs Kantate Ein Überlebender aus Warschau beschreiben?', 'mention': 'Ein Überlebender aus Warschau'}, {'translation': 'Wie würden Sie Arnold Schoenbergs Kantate Ein Überlebender aus Warschau beschreiben?', 'mention': 'Ein Überlebender aus Warschau'}]	en	de
Q664500_1	Q664500	['Musical work']	Who composed the musical work A Survivor from Warsaw?	[{'translation': 'Wer komponierte das musikalische Werk Ein Überlebender aus Warschau?', 'mention': 'Ein Überlebender aus Warschau'}]	en	de
Q664500_2	Q664500	['Musical work']	What is the genre of A Survivor from Warsaw?	[{'translation': 'Was ist das Genre von Ein Überlebender aus Warschau?', 'mention': 'Ein Überlebender aus Warschau'}]	en	de
Q669358_0	Q669358	['Musical work']	What is the genre of Beethoven's Violin Sonata No. 5?	[{'translation': 'Welches Genre hat Beethovens Violinsonate Nr. 5?', 'mention': 'Violinsonate Nr. 5'}, {'translation': 'Zu welcher Gattung gehört Beethovens Violinsonate Nr. 5?', 'mention': 'Violinsonate Nr. 5'}]	en	de
Q669358_1	Q669358	['Musical work']	Who composed the Violin Sonata No. 5?	[{'translation': 'Wer hat die Violinsonate Nr. 5 komponiert?', 'mention': 'Violinsonate Nr. 5'}, {'translation': 'Wer komponierte die Violinsonate Nr. 5?', 'mention': 'Violinsonate Nr. 5?'}]	en	de
Q669358_2	Q669358	['Musical work']	How many movements are there in Beethoven's Violin Sonata No. 5?	[{'translation': 'Wie viele Sätze hat Beethovens Violinsonate Nr. 5?', 'mention': 'Violinsonate Nr. 5'}, {'translation': 'Wie viele Sätze gibt es in Beethovens Violinsonate Nr. 5?', 'mention': 'Violinsonate Nr. 5'}]	en	de
Q6705257_0	Q6705257	['Artwork', 'Book']	How would you describe Lust, Caution?	[{'translation': 'Wie würden Sie Gefahr und Begierde beschreiben?', 'mention': 'Gefahr und Begierde'}]	en	de
Q6705257_1	Q6705257	['Artwork', 'Book']	Who is the author of the 1979 novel, Lust, Caution?	[{'translation': 'Wer ist der Autor des Romans Gefahr und Begierde aus dem Jahr 1979?', 'mention': 'Gefahr und Begierde'}]	en	de
Q6705257_2	Q6705257	['Artwork', 'Book']	What is the genre of Lust, Caution?	[{'translation': 'Was ist das Genre von Gefahr und Begierde?', 'mention': 'Gefahr und Begierde'}, {'translation': 'Zu welchem Genre gehört Gefahr und Begierde?', 'mention': 'Gefahr und Begierde'}]	en	de
Q687629_0	Q687629	['Landmark']	What type of hill is Batu Caves made of?	[{'translation': 'Aus welcher Art von Hügeln bestehen die Batu Caves?', 'mention': 'Batu Caves'}]	en	de
Q687629_1	Q687629	['Landmark']	What is the main feature of Batu Caves?	[{'translation': 'Was ist das Hauptmerkmal der Batu-Höhlen?', 'mention': 'Batu-Höhlen'}]	en	de
Q687629_2	Q687629	['Landmark']	Where can Batu Caves be found in Malaysia?	[{'translation': 'Wo gibt es Batu-Höhlen in Malaysia?', 'mention': 'Batu-Höhlen'}, {'translation': 'Wo befinden sich die Batu-Höhlen in Malaysia?', 'mention': 'Batu-Höhlen'}]	en	de
Q688919_0	Q688919	['Artwork']	Can you describe The Visit?	[{'translation': 'Können Sie Der Besuch der alten Dame beschreiben?', 'mention': 'Der Besuch der alten Dame'}, {'translation': 'Können Sie der Besuch der alten Dame beschreiben?', 'mention': 'Der Besuch der alten Dame'}]	en	de
Q688919_1	Q688919	['Artwork']	Who is the author of The Visit?	[{'translation': 'Wer ist der Autor von Der Besuch der alten Dame?', 'mention': 'Der Besuch der alten Dame'}, {'translation': 'Wer ist der Autor von der Besuch der alten Dame?', 'mention': 'Der Besuch der alten Dame'}]	en	de
Q688919_2	Q688919	['Artwork']	Is The Visit a tragicomic play?	[{'translation': 'Ist Der Besuch der alten Dame ein tragikomisches Stück?', 'mention': 'Der Besuch der alten Dame'}, {'translation': 'Ist der Besuch der alten Dame ein tragikomisches Stück?', 'mention': 'Der Besuch der alten Dame'}]	en	de
Q6945559_0	Q6945559	['Movie', 'TV series']	Can you recommend any similar movies or TV shows to My Ghost Story?	[{'translation': 'Können Sie ähnliche Filme oder Fernsehsendungen zu Übersinnliche Phänomene empfehlen?', 'mention': 'Übersinnliche Phänomene'}]	en	de
Q6945559_1	Q6945559	['Movie', 'TV series']	How many seasons does My Ghost Story have?	[{'translation': 'Wie viele Staffeln hat Übersinnliche Phänomene?', 'mention': 'Übersinnliche Phänomene'}]	en	de
Q6945559_2	Q6945559	['Movie', 'TV series']	Who are the main characters in My Ghost Story?	[{'translation': 'Wer sind die Hauptfiguren in Übersinnliche Phänomene?', 'mention': 'Übersinnliche Phänomene'}]	en	de
Q699448_0	Q699448	['Landmark', 'Artwork']	Who commissioned the creation of the Monument to the Battle of the Nations?	[{'translation': 'Wer hat die Schaffung des Völkerschlachtdenkmal in Auftrag gegeben?', 'mention': 'Völkerschlachtdenkmal'}, {'translation': 'Wer hat die Schaffung des Völkerschlachtdenkmals in Auftrag gegeben?', 'mention': 'Völkerschlachtdenkmals'}, {'translation': 'Wer hat die Errichtung des Völkerschlachtdenkmals in Auftrag gegeben?', 'mention': 'Völkerschlachtdenkmals'}]	en	de
Q699448_1	Q699448	['Landmark', 'Artwork']	Where is the Monument to the Battle of the Nations located in Germany?	[{'translation': 'Wo befindet sich das Völkerschlachtdenkmal in Deutschland?', 'mention': 'Völkerschlachtdenkmal'}, {'translation': 'Wo in Deutschland befindet sich das Völkerschlachtdenkmal?', 'mention': 'Völkerschlachtdenkmal'}]	en	de
Q699448_2	Q699448	['Landmark', 'Artwork']	When was the Monument to the Battle of the Nations constructed?	[{'translation': 'Wann wurde das Völkerschlachtdenkmal gebaut?', 'mention': 'Völkerschlachtdenkmal'}, {'translation': 'Wann wurde das Völkerschlachtdenkmal errichtet?', 'mention': 'Völkerschlachtdenkmal'}]	en	de
Q704973_0	Q704973	['Person']	Where did Theodoros II Palaiologos hold his position as despot?	[{'translation': 'Wo hatte Theodor II seine Position als Despot inne?', 'mention': 'Theodor II'}, {'translation': 'Wo hatte Theodor II. seine Position als Despot inne?', 'mention': 'Theodor II.'}]	en	de
Q704973_1	Q704973	['Person']	What role did Theodoros II Palaiologos have in Morea?	[{'translation': 'Welche Rolle spielte Theodor II in Morea?', 'mention': 'Theodor II'}, {'translation': 'Welche Rolle spielte Theodor II. in Morea?', 'mention': 'Theodor II.'}]	en	de
Q704973_2	Q704973	['Person']	When was Theodoros II Palaiologos active as despot?	[{'translation': 'Wann war Theodor II als Despot aktiv?', 'mention': 'Theodor II'}, {'translation': 'Wann war Theodor II. als Despot aktiv?', 'mention': 'Theodor II.'}]	en	de
Q7203254_0	Q7203254	['Book']	Can the Player's Handbook be used for multiple editions of Dungeons & Dragons?	[{'translation': 'Kann das Spielerhandbuch für mehrere Ausgaben von Dungeons & Dragons verwendet werden?', 'mention': 'Spielerhandbuch'}, {'translation': 'Kann das Spielerhandbuch für mehrere Editionen von Dungeons & Dragons verwendet werden?', 'mention': 'Spielerhandbuch'}]	en	de
Q7203254_1	Q7203254	['Book']	How does the Player's Handbook help players create and develop their characters?	[{'translation': 'Wie hilft das Spielerhandbuch den Spielern, ihre Charaktere zu erstellen und zu entwickeln?', 'mention': 'Spielerhandbuch'}, {'translation': 'Wie hilft das Spielerhandbuch den Spielern bei der Erstellung und Entwicklung ihrer Charaktere?', 'mention': 'Spielerhandbuch'}]	en	de
